{
	"$schema": "../Aurora.schema.json",
	"uuid": "7b6b8d4b-1c6f-4c0e-9c08-5c6a1f5a8b2f",
	"id": "cli_and_https_api_modes",
	"card_type": "feature",
	"name": "CLI and HTTPS API modes",
	"description": "Operate as a standalone CLI tool or as an HTTPS API (HTTP/2-only) with TLS 1.3+ transport and OAuth 2.0 authentication, supporting both human-readable and JSON output formats.",
	"version": "1.0.0",
	"attributes": {
		"source": "README.md"
	},
	"links": [
		{
			"relationship": "satisfies",
			"target": "aaf48cba-55e2-4d9d-89f8-787461af1416"
		}
	],
	"audit_history": [
		{
			"event": "created",
			"user": "agent:architect",
			"timestamp": "2026-01-10T23:58:00Z"
		}
	]
}
