{
	"$schema": "../Aurora.schema.json",
	"uuid": "aaf48cba-55e2-4d9d-89f8-787461af1416",
	"id": "breach_data_analysis_tool",
	"card_type": "requirement",
	"name": "Breach Data Analysis Tool",
	"description": "A high-performance bulk data analysis system for threat intelligence and credential breach analysis.",
	"version": "1.1.0",
	"attributes": {
		"name": "Dumptruck"
	},
	"links": [
		{
			"relationship": "imposes",
			"target": "0b7b2d5b-9d45-4f3a-9d9c-1c2b3a4d5e6f"
		},
		{
			"relationship": "imposes",
			"target": "1c2d3e4f-5a6b-4c7d-8e9f-0a1b2c3d4e5f"
		},
		{
			"relationship": "imposes",
			"target": "2d3e4f5a-6b7c-4d8e-9f0a-1b2c3d4e5f6a"
		}
	],
	"audit_history": [
		{
			"event": "created",
			"user": "agent:architect",
			"timestamp": "2026-01-10T23:35:32Z"
		},
		{
			"event": "edited",
			"user": "agent:architect",
			"timestamp": "2026-01-11T00:22:30Z"
		}
	]
}
