{
	"$schema": "../Aurora.schema.json",
	"uuid": "2b3c4d5e-6f7a-4b8c-9d0e-1f2a3b4c5d6e",
	"id": "analyze",
	"card_type": "component",
	"name": "analyze",
	"description": "Bulk ingestion + normalization + detection + enrichment pipeline for breach/threat-intel datasets, optimized for streaming and scale.",
	"version": "1.3.0",
	"attributes": {
		"rust_module": "src/analyze"
	},
	"links": [
		{
			"relationship": "implements",
			"target": "7b6b8d4b-1c6f-4c0e-9c08-5c6a1f5a8b2f"
		},
		{
			"relationship": "implements",
			"target": "6e6e5d5a-2f0b-4b2a-9e9a-0c2c4fb1d46b"
		},
		{
			"relationship": "implements",
			"target": "a58fd4d6-01e3-4a6f-8a79-3f9e64b2b8b0"
		},
		{
			"relationship": "implements",
			"target": "8c1f7f33-0a4e-4c1b-8a9f-1fdb3bbd4e6b"
		},
		{
			"relationship": "generates",
			"target": "b549f9ba-f06a-4f99-adf0-3b65ed8bab95"
		},
		{
			"relationship": "generates",
			"target": "3d85ffd1-4613-4283-96b1-9d059b2e5687"
		}
	],
	"audit_history": [
		{
			"event": "created",
			"user": "agent:architect",
			"timestamp": "2026-01-11T00:08:00Z"
		},
		{
			"event": "edited",
			"user": "agent:architect",
			"timestamp": "2026-01-11T00:14:00Z"
		},
		{
			"event": "edited",
			"user": "agent:architect",
			"timestamp": "2026-01-11T00:20:10Z"
		},
		{
			"event": "edited",
			"user": "agent:architect",
			"timestamp": "2026-01-11T00:41:10Z"
		}
	]
}
