{
	"$schema": "../Aurora.schema.json",
	"uuid": "3b2a1c0d-9e8f-4a7b-8c6d-5e4f3a2b1c0d",
	"id": "enrich_findings_and_score_risk",
	"card_type": "story",
	"name": "Enrich findings and score risk",
	"description": "A User wants enriched context and prioritization for remediation. The system enriches findings and computes a 0-100 risk score based on weak passwords, compromise potential, breach history, and anomaly contributions, optionally using configured integrations.",
	"version": "1.0.0",
	"attributes": {
		"source": "README.md"
	},
	"links": [
		{
			"relationship": "explains",
			"target": "a58fd4d6-01e3-4a6f-8a79-3f9e64b2b8b0"
		}
	],
	"audit_history": [
		{
			"event": "created",
			"user": "agent:architect",
			"timestamp": "2026-01-11T00:04:00Z"
		}
	]
}
