{
	"$schema": "../Aurora.schema.json",
	"uuid": "6f7a8b9c-0d1e-4f2a-3b4c-5d6e7f8a9b0c",
	"id": "configuration",
	"card_type": "component",
	"name": "configuration",
	"description": "Configuration loading, validation, and defaults for CLI/server operation and feature toggles.",
	"version": "1.1.0",
	"attributes": {
		"rust_module": "src/configuration.rs"
	},
	"links": [
		{
			"relationship": "implements",
			"target": "7b6b8d4b-1c6f-4c0e-9c08-5c6a1f5a8b2f"
		}
	],
	"audit_history": [
		{
			"event": "created",
			"user": "agent:architect",
			"timestamp": "2026-01-11T00:08:00Z"
		},
		{
			"event": "edited",
			"user": "agent:architect",
			"timestamp": "2026-01-11T00:18:00Z"
		}
	]
}
