{
	"$schema": "../Aurora.schema.json",
	"uuid": "1e7b3c2d-0f1a-4b6d-9c7e-2a1b3c4d5e6f",
	"id": "database",
	"card_type": "component",
	"name": "database",
	"description": "Persistence and historical intelligence storage layer (SQLite + schema/migrations), storing only non-reversible hashes for privacy-preserving recall.",
	"version": "1.3.0",
	"attributes": {
		"rust_module": "src/database"
	},
	"links": [
		{
			"relationship": "implements",
			"target": "7b6b8d4b-1c6f-4c0e-9c08-5c6a1f5a8b2f"
		},
		{
			"relationship": "implements",
			"target": "0e6b2c44-6b2c-4b1b-9e34-9e52a5c3f6a4"
		},
		{
			"relationship": "implements",
			"target": "3f0b6c1a-0c5a-4a1e-8a5d-4d7f0f8c2b4a"
		},
		{
			"relationship": "depends_on",
			"target": "05b01a6d-22f1-4fc0-af27-be5cde0be72f"
		}
	],
	"audit_history": [
		{
			"event": "created",
			"user": "agent:architect",
			"timestamp": "2026-01-11T00:08:00Z"
		},
		{
			"event": "edited",
			"user": "agent:architect",
			"timestamp": "2026-01-11T00:14:10Z"
		},
		{
			"event": "edited",
			"user": "agent:architect",
			"timestamp": "2026-01-11T00:20:00Z"
		},
		{
			"event": "edited",
			"user": "agent:architect",
			"timestamp": "2026-01-11T00:41:20Z"
		}
	]
}
