{
	"$schema": "../Aurora.schema.json",
	"uuid": "b549f9ba-f06a-4f99-adf0-3b65ed8bab95",
	"id": "analysis_report",
	"card_type": "artifact",
	"name": "Analysis Report",
	"description": "A user-facing report artifact produced by the analysis pipeline, summarizing findings (detections, counts, risk scores, and notable entities) for review and downstream workflows.",
	"version": "1.0.0",
	"attributes": {},
	"links": [],
	"audit_history": [
		{
			"event": "created",
			"user": "agent:architect",
			"timestamp": "2026-01-11T00:40:00Z"
		}
	]
}
