{
	"$schema": "../Aurora.schema.json",
	"uuid": "a11962af-32b2-4b09-a936-441d1364452f",
	"id": "develop_cti_workforce_maturity_plan",
	"card_type": "driver",
	"name": "Develop a CTI workforce maturity plan",
	"description": "Develop and implement a structured workforce maturity plan to enhance CTI team capabilities through targeted training, role specialization, and career progression frameworks, ensuring alignment with evolving threat landscapes and organizational policies.",
	"version": "1.0.0",
	"attributes": {},
	"links": [],
	"audit_history": [
		{
			"event": "created",
			"user": "agent:architect",
			"timestamp": "2026-01-10T23:23:50Z"
		}
	]
}
